{
  "site_name": "Land at Lancaster Avenue, Chapelhall",
  "settlement": "Chapelhall",
  "address": "Land At Lancaster Avenue, Chapelhall, North Lanarkshire",
  "latitude": 55.83653,
  "longitude": -3.93559,
  "location_precision": "site_centroid",
  "boundary_precision": "red_line_official",
  "max_building_height_m": {
    "value": 26,
    "unit": "m",
    "state": "developer_stated",
    "claimant": "DataVita",
    "notes": "Revised maximum announced with the 2 September 2026 submission; reduced from 30 m during consultation. Awaiting confirmation in validated application documents.",
    "source_ids": [
      "src-datavita-dv4-submission-2026"
    ]
  },
  "greenfield_brownfield": "greenfield",
  "green_belt": true,
  "current_land_use": "Green Belt land east of Chapelhall; a previous consented/proposed scheme for the site comprised a restaurant and other development per APRS's reading of the screening report",
  "nearest_settlements": [
    "Chapelhall",
    "Newhouse"
  ],
  "land_notes": "Coordinates are the application point from the council portal record (easting/northing 278876/662062). A validated application boundary had not been published by 3 September 2026. DataVita says the submitted design adds more than 1,000 m of native hedgerow; this remains a developer commitment pending the application documents.",
  "source_ids": [
    "src-planit-nlc-25-01322-pan",
    "src-planit-nlc-26-00707-eiascr",
    "src-datavita-dv4-submission-2026",
    "src-aprs-chapelhall-aigz"
  ]
}
