{
  "site_name": "Land to the north of Camilla Road, Gleniston (Camilla Farm), Auchtertool",
  "address": "Land To The North Of Camilla Road, Gleniston, Auchtertool, Fife",
  "settlement": "Auchtertool",
  "latitude": 56.109111,
  "longitude": -3.265364,
  "location_precision": "approximate",
  "boundary_precision": "none",
  "site_area_m2": {
    "value": 250000,
    "unit": "m2",
    "state": "reported",
    "claimant": "Data Center Dynamics (reporting the application)",
    "confidence": "low",
    "notes": "Reported as a '25-hectare development' (61 acres). Sits oddly against the reported 280,000 m2 of buildings — the red-line area is likely larger; verify against the location plan on the Fife portal.",
    "source_ids": ["src-dcd-filing"]
  },
  "gross_floor_area_m2": {
    "value": 280000,
    "unit": "m2",
    "state": "reported",
    "claimant": "SPICe / Architects' Journal (from application material)",
    "confidence": "medium",
    "preferred": true,
    "preferred_rationale": "Consistent across SPICe ('almost 40 football pitches' of buildings) and AJ (280,000 m2 across six identical buildings); whether it is footprint or gross floor area is not fully clear from secondary sources.",
    "notes": "Described variously as building area/site coverage.",
    "source_ids": ["src-spice-data-centres", "src-aj-design"]
  },
  "max_building_height_m": {
    "value": 35,
    "unit": "m",
    "state": "reported",
    "claimant": "SPICe / Fife Council application description",
    "confidence": "high",
    "notes": "Data halls up to 35 m ('roughly a 12-storey block of flats'); community council was told 30-35 m pre-application.",
    "source_ids": ["src-spice-data-centres", "src-cft-eia", "src-acc-village-update"]
  },
  "number_of_buildings": {
    "value": null,
    "min": 6,
    "max": 7,
    "unit": "buildings",
    "state": "reported",
    "claimant": "Architects' Journal (six identical buildings) / STV News (up to seven buildings plus on-site substation)",
    "confidence": "medium",
    "notes": "Conflicting counts preserved: six data halls of identical footprint (AJ, from the architect) vs 'up to seven buildings' (STV, from site plans). PPP stage, so illustrative only.",
    "source_ids": ["src-aj-design", "src-stv-community"]
  },
  "greenfield_brownfield": "greenfield",
  "current_land_use": "Agricultural land (farmland)",
  "nearest_settlements": ["Auchtertool (~215 houses, immediately south-east)", "Kirkcaldy", "Cowdenbeath"],
  "land_notes": "Farmland north-west of Auchtertool, between Kirkcaldy and Cowdenbeath; access proposed from the B925. APRS states submitted plans show buildings covering the ruins of Hallyards Castle, and that a newly constructed ILI battery energy storage system sits immediately east of the site. Community council reported ~25% of the site would be visible from most of the village. Agricultural land classification not established (see project unknowns). SEPA lodged a holding objection in July 2026 pending further flooding information.",
  "source_ids": ["src-fife-portal-26-01243-ppp", "src-aprs-auchtertool", "src-stv-community", "src-acc-village-update", "src-cft-14000"]
}
