{
  "site_name": "Brightsolid Aberdeen Data Centre",
  "settlement": "Aberdeen (Mastrick / Whitemyres area, west Aberdeen)",
  "latitude": 57.15,
  "longitude": -2.17,
  "location_precision": "coarse_deliberate",
  "greenfield_brownfield": "unknown",
  "current_land_use": "Operating data centre in a west-Aberdeen industrial area",
  "land_notes": "Coordinates coarsened to district level (operating sensitive infrastructure). Whitemyres Avenue location is publicly listed in directories and PeeringDB.",
  "source_ids": [
    "src-baxtel-brightsolid",
    "src-dcd-brightsolid"
  ]
}
